[
    {
        "unique-color-id": "12599946",
        "name": "Rose Violet",
        "other-names": [
            {
                "name": "Rose Violet",
                "source": {
                    "name": "Pantone",
                    "url": "http://www.pantone.com"
                }
            },
            {
                "name": "17-2624",
                "source": {
                    "name": "pantone-number",
                    "url": "http://www.pantone.com"
                }
            },
            {
                "name": "Orchid Ecstasy",
                "source": {
                    "name": "color.pizza",
                    "url": "https://github.com/meodai/color-names"
                }
            }
        ],
        "naming-source": "Pantone",
        "nickname": "",
        "color-family": "Pink Shades",
        "color-codes": {
            "hex": {
                "values": {
                    "r1": "C",
                    "r2": "0",
                    "g1": "4",
                    "g2": "2",
                    "b1": "8",
                    "b2": "A",
                    "a1": "0",
                    "a2": "0"
                }
            },
            "rgb": {
                "values": {
                    "r": 192,
                    "g": 66,
                    "b": 138
                }
            },
            "hsl": {
                "values": {
                    "h": 326,
                    "s": 50,
                    "l": 51
                }
            },
            "cmyk": {
                "values": {
                    "c": 0,
                    "m": 66,
                    "y": 28,
                    "k": 25
                }
            }
        },
        "description": "A medium, moderately saturated pink with warm purple-magenta tones."
    }
]
