[
    {
        "unique-color-id": "15650990",
        "name": "Autumn Blonde",
        "other-names": [
            {
                "name": "Autumn Blonde",
                "source": {
                    "name": "Pantone",
                    "url": "http://www.pantone.com"
                }
            },
            {
                "name": "12-0813",
                "source": {
                    "name": "pantone-number",
                    "url": "http://www.pantone.com"
                }
            },
            {
                "name": "Chai",
                "source": {
                    "name": "color.pizza",
                    "url": "https://github.com/meodai/color-names"
                }
            }
        ],
        "naming-source": "Pantone",
        "nickname": "",
        "color-family": "Orange Shades",
        "color-codes": {
            "hex": {
                "values": {
                    "r1": "E",
                    "r2": "E",
                    "g1": "D",
                    "g2": "0",
                    "b1": "A",
                    "b2": "E",
                    "a1": "0",
                    "a2": "0"
                }
            },
            "rgb": {
                "values": {
                    "r": 238,
                    "g": 208,
                    "b": 174
                }
            },
            "hsl": {
                "values": {
                    "h": 32,
                    "s": 65,
                    "l": 81
                }
            },
            "cmyk": {
                "values": {
                    "c": 0,
                    "m": 13,
                    "y": 27,
                    "k": 7
                }
            }
        },
        "description": "A light, vibrant orange with warm orange-yellow tones."
    }
]
