[
    {
        "unique-color-id": "15509541",
        "name": "Old Gold",
        "other-names": [
            {
                "name": "Old Gold",
                "source": {
                    "name": "Pantone",
                    "url": "http://www.pantone.com"
                }
            },
            {
                "name": "15-0955",
                "source": {
                    "name": "pantone-number",
                    "url": "http://www.pantone.com"
                }
            },
            {
                "name": "Apricot Glazed Chicken",
                "source": {
                    "name": "color.pizza",
                    "url": "https://github.com/meodai/color-names"
                }
            }
        ],
        "naming-source": "Pantone",
        "nickname": "",
        "color-family": "Orange Shades",
        "color-codes": {
            "hex": {
                "values": {
                    "r1": "E",
                    "r2": "C",
                    "g1": "A",
                    "g2": "8",
                    "b1": "2",
                    "b2": "5",
                    "a1": "0",
                    "a2": "0"
                }
            },
            "rgb": {
                "values": {
                    "r": 236,
                    "g": 168,
                    "b": 37
                }
            },
            "hsl": {
                "values": {
                    "h": 39,
                    "s": 84,
                    "l": 54
                }
            },
            "cmyk": {
                "values": {
                    "c": 0,
                    "m": 29,
                    "y": 84,
                    "k": 7
                }
            }
        },
        "description": "A medium, highly saturated orange with warm orange-yellow tones."
    }
]
