[
    {
        "unique-color-id": "15493687",
        "name": "Mandarin Orange",
        "other-names": [
            {
                "name": "Mandarin Orange",
                "source": {
                    "name": "Pantone",
                    "url": "http://www.pantone.com"
                }
            },
            {
                "name": "16-1459",
                "source": {
                    "name": "pantone-number",
                    "url": "http://www.pantone.com"
                }
            }
        ],
        "naming-source": "Pantone",
        "nickname": "",
        "color-family": "Orange Shades",
        "color-codes": {
            "hex": {
                "values": {
                    "r1": "E",
                    "r2": "C",
                    "g1": "6",
                    "g2": "A",
                    "b1": "3",
                    "b2": "7",
                    "a1": "0",
                    "a2": "0"
                }
            },
            "rgb": {
                "values": {
                    "r": 236,
                    "g": 106,
                    "b": 55
                }
            },
            "hsl": {
                "values": {
                    "h": 17,
                    "s": 83,
                    "l": 57
                }
            },
            "cmyk": {
                "values": {
                    "c": 0,
                    "m": 55,
                    "y": 77,
                    "k": 7
                }
            }
        },
        "description": "A medium-light, highly saturated orange with warm red tones."
    }
]
