[
    {
        "unique-color-id": "10907258",
        "name": "Mesa Rose",
        "other-names": [
            {
                "name": "Mesa Rose",
                "source": {
                    "name": "Pantone",
                    "url": "http://www.pantone.com"
                }
            },
            {
                "name": "17-1609",
                "source": {
                    "name": "pantone-number",
                    "url": "http://www.pantone.com"
                }
            },
            {
                "name": "Black Elder",
                "source": {
                    "name": "color.pizza",
                    "url": "https://github.com/meodai/color-names"
                }
            }
        ],
        "naming-source": "Pantone",
        "nickname": "",
        "color-family": "Red Shades",
        "color-codes": {
            "hex": {
                "values": {
                    "r1": "A",
                    "r2": "6",
                    "g1": "6",
                    "g2": "E",
                    "b1": "7",
                    "b2": "A",
                    "a1": "0",
                    "a2": "0"
                }
            },
            "rgb": {
                "values": {
                    "r": 166,
                    "g": 110,
                    "b": 122
                }
            },
            "hsl": {
                "values": {
                    "h": 347,
                    "s": 24,
                    "l": 54
                }
            },
            "cmyk": {
                "values": {
                    "c": 0,
                    "m": 34,
                    "y": 27,
                    "k": 35
                }
            }
        },
        "description": "A medium, muted red with warm red-pink tones."
    }
]
