[
    {
        "unique-color-id": "10692695",
        "name": "Vivacious",
        "other-names": [
            {
                "name": "Vivacious",
                "source": {
                    "name": "Pantone",
                    "url": "http://www.pantone.com"
                }
            },
            {
                "name": "19-2045",
                "source": {
                    "name": "pantone-number",
                    "url": "http://www.pantone.com"
                }
            },
            {
                "name": "Cherries Jubilee",
                "source": {
                    "name": "color.pizza",
                    "url": "https://github.com/meodai/color-names"
                }
            }
        ],
        "naming-source": "Pantone",
        "nickname": "",
        "color-family": "Pink Shades",
        "color-codes": {
            "hex": {
                "values": {
                    "r1": "A",
                    "r2": "3",
                    "g1": "2",
                    "g2": "8",
                    "b1": "5",
                    "b2": "7",
                    "a1": "0",
                    "a2": "0"
                }
            },
            "rgb": {
                "values": {
                    "r": 163,
                    "g": 40,
                    "b": 87
                }
            },
            "hsl": {
                "values": {
                    "h": 337,
                    "s": 61,
                    "l": 40
                }
            },
            "cmyk": {
                "values": {
                    "c": 0,
                    "m": 75,
                    "y": 47,
                    "k": 36
                }
            }
        },
        "description": "A medium-dark, vibrant pink with warm red-pink tones."
    }
]
