[
    {
        "unique-color-id": "16764328",
        "name": "Creampuff",
        "other-names": [
            {
                "name": "Creampuff",
                "source": {
                    "name": "Pantone",
                    "url": "http://www.pantone.com"
                }
            },
            {
                "name": "13-1026",
                "source": {
                    "name": "pantone-number",
                    "url": "http://www.pantone.com"
                }
            },
            {
                "name": "Orenju Ogon Koi",
                "source": {
                    "name": "color.pizza",
                    "url": "https://github.com/meodai/color-names"
                }
            }
        ],
        "naming-source": "Pantone",
        "nickname": "",
        "color-family": "Orange Shades",
        "color-codes": {
            "hex": {
                "values": {
                    "r1": "F",
                    "r2": "F",
                    "g1": "C",
                    "g2": "D",
                    "b1": "A",
                    "b2": "8",
                    "a1": "0",
                    "a2": "0"
                }
            },
            "rgb": {
                "values": {
                    "r": 255,
                    "g": 205,
                    "b": 168
                }
            },
            "hsl": {
                "values": {
                    "h": 26,
                    "s": 100,
                    "l": 83
                }
            },
            "cmyk": {
                "values": {
                    "c": 0,
                    "m": 20,
                    "y": 34,
                    "k": 0
                }
            }
        },
        "description": "A light, highly saturated orange with warm red tones."
    }
]
