[
    {
        "unique-color-id": "12961221",
        "name": "Lunar Rock",
        "other-names": [
            {
                "name": "Lunar Rock",
                "source": {
                    "name": "Pantone",
                    "url": "http://www.pantone.com"
                }
            },
            {
                "name": "14-4201",
                "source": {
                    "name": "pantone-number",
                    "url": "http://www.pantone.com"
                }
            }
        ],
        "naming-source": "Pantone",
        "nickname": "",
        "color-family": "Grey Shades",
        "color-codes": {
            "hex": {
                "values": {
                    "r1": "C",
                    "r2": "5",
                    "g1": "C",
                    "g2": "5",
                    "b1": "C",
                    "b2": "5",
                    "a1": "0",
                    "a2": "0"
                }
            },
            "rgb": {
                "values": {
                    "r": 197,
                    "g": 197,
                    "b": 197
                }
            },
            "hsl": {
                "values": {
                    "h": 0,
                    "s": 0,
                    "l": 77
                }
            },
            "cmyk": {
                "values": {
                    "c": 0,
                    "m": 0,
                    "y": 0,
                    "k": 23
                }
            }
        },
        "description": "A light, neutral grey."
    }
]
