[
    {
        "unique-color-id": "3976660",
        "name": "Aquarius",
        "other-names": [
            {
                "name": "Aquarius",
                "source": {
                    "name": "Pantone",
                    "url": "http://www.pantone.com"
                }
            },
            {
                "name": "16-4530",
                "source": {
                    "name": "pantone-number",
                    "url": "http://www.pantone.com"
                }
            },
            {
                "name": "Bright Cerulean",
                "source": {
                    "name": "color.pizza",
                    "url": "https://github.com/meodai/color-names"
                }
            }
        ],
        "naming-source": "Pantone",
        "nickname": "",
        "color-family": "Blue Shades",
        "color-codes": {
            "hex": {
                "values": {
                    "r1": "3",
                    "r2": "C",
                    "g1": "A",
                    "g2": "D",
                    "b1": "D",
                    "b2": "4",
                    "a1": "0",
                    "a2": "0"
                }
            },
            "rgb": {
                "values": {
                    "r": 60,
                    "g": 173,
                    "b": 212
                }
            },
            "hsl": {
                "values": {
                    "h": 195,
                    "s": 64,
                    "l": 53
                }
            },
            "cmyk": {
                "values": {
                    "c": 72,
                    "m": 18,
                    "y": 0,
                    "k": 17
                }
            }
        },
        "description": "A medium, vibrant blue with cool cyan-blue tones."
    }
]
