[
    {
        "unique-color-id": "7289942",
        "name": "Amaranth",
        "other-names": [
            {
                "name": "Amaranth",
                "source": {
                    "name": "Pantone",
                    "url": "http://www.pantone.com"
                }
            },
            {
                "name": "19-2410",
                "source": {
                    "name": "pantone-number",
                    "url": "http://www.pantone.com"
                }
            },
            {
                "name": "Royal Lines",
                "source": {
                    "name": "color.pizza",
                    "url": "https://github.com/meodai/color-names"
                }
            }
        ],
        "naming-source": "Pantone",
        "nickname": "",
        "color-family": "Pink Shades",
        "color-codes": {
            "hex": {
                "values": {
                    "r1": "6",
                    "r2": "F",
                    "g1": "3",
                    "g2": "C",
                    "b1": "5",
                    "b2": "6",
                    "a1": "0",
                    "a2": "0"
                }
            },
            "rgb": {
                "values": {
                    "r": 111,
                    "g": 60,
                    "b": 86
                }
            },
            "hsl": {
                "values": {
                    "h": 329,
                    "s": 30,
                    "l": 34
                }
            },
            "cmyk": {
                "values": {
                    "c": 0,
                    "m": 46,
                    "y": 23,
                    "k": 56
                }
            }
        },
        "description": "A medium-dark, muted pink with warm purple-magenta tones."
    }
]
