[
    {
        "unique-color-id": "15790050",
        "name": "Cannoli Cream",
        "other-names": [
            {
                "name": "Cannoli Cream",
                "source": {
                    "name": "Pantone",
                    "url": "http://www.pantone.com"
                }
            },
            {
                "name": "11-4302",
                "source": {
                    "name": "pantone-number",
                    "url": "http://www.pantone.com"
                }
            },
            {
                "name": "Snowy Pine",
                "source": {
                    "name": "color.pizza",
                    "url": "https://github.com/meodai/color-names"
                }
            }
        ],
        "naming-source": "Pantone",
        "nickname": "",
        "color-family": "Yellow Shades",
        "color-codes": {
            "hex": {
                "values": {
                    "r1": "F",
                    "r2": "0",
                    "g1": "E",
                    "g2": "F",
                    "b1": "E",
                    "b2": "2",
                    "a1": "0",
                    "a2": "0"
                }
            },
            "rgb": {
                "values": {
                    "r": 240,
                    "g": 239,
                    "b": 226
                }
            },
            "hsl": {
                "values": {
                    "h": 56,
                    "s": 32,
                    "l": 91
                }
            },
            "cmyk": {
                "values": {
                    "c": 0,
                    "m": 0,
                    "y": 6,
                    "k": 6
                }
            }
        },
        "description": "A very light, moderately saturated yellow with warm orange-yellow tones."
    }
]
