[
    {
        "unique-color-id": "9256749",
        "name": "Picante",
        "other-names": [
            {
                "name": "Picante",
                "source": {
                    "name": "Pantone",
                    "url": "http://www.pantone.com"
                }
            },
            {
                "name": "19-1250",
                "source": {
                    "name": "pantone-number",
                    "url": "http://www.pantone.com"
                }
            },
            {
                "name": "Fire",
                "source": {
                    "name": "color.pizza",
                    "url": "https://github.com/meodai/color-names"
                }
            }
        ],
        "naming-source": "Pantone",
        "nickname": "",
        "color-family": "Orange Shades",
        "color-codes": {
            "hex": {
                "values": {
                    "r1": "8",
                    "r2": "D",
                    "g1": "3",
                    "g2": "F",
                    "b1": "2",
                    "b2": "D",
                    "a1": "0",
                    "a2": "0"
                }
            },
            "rgb": {
                "values": {
                    "r": 141,
                    "g": 63,
                    "b": 45
                }
            },
            "hsl": {
                "values": {
                    "h": 11,
                    "s": 52,
                    "l": 36
                }
            },
            "cmyk": {
                "values": {
                    "c": 0,
                    "m": 55,
                    "y": 68,
                    "k": 45
                }
            }
        },
        "description": "A medium-dark, vibrant orange with warm red tones."
    }
]
