[
    {
        "unique-color-id": "4402247",
        "name": "Purple Pennant",
        "other-names": [
            {
                "name": "Purple Pennant",
                "source": {
                    "name": "Pantone",
                    "url": "http://www.pantone.com"
                }
            },
            {
                "name": "19-3519",
                "source": {
                    "name": "pantone-number",
                    "url": "http://www.pantone.com"
                }
            }
        ],
        "naming-source": "Pantone",
        "nickname": "",
        "color-family": "Pink Shades",
        "color-codes": {
            "hex": {
                "values": {
                    "r1": "4",
                    "r2": "3",
                    "g1": "2",
                    "g2": "C",
                    "b1": "4",
                    "b2": "7",
                    "a1": "0",
                    "a2": "0"
                }
            },
            "rgb": {
                "values": {
                    "r": 67,
                    "g": 44,
                    "b": 71
                }
            },
            "hsl": {
                "values": {
                    "h": 291,
                    "s": 23,
                    "l": 23
                }
            },
            "cmyk": {
                "values": {
                    "c": 6,
                    "m": 38,
                    "y": 0,
                    "k": 72
                }
            }
        },
        "description": "A dark, muted pink with warm purple-magenta tones."
    }
]
