[
    {
        "unique-color-id": "5788738",
        "name": "Ivy Green",
        "other-names": [
            {
                "name": "Ivy Green",
                "source": {
                    "name": "Pantone",
                    "url": "http://www.pantone.com"
                }
            },
            {
                "name": "19-0512",
                "source": {
                    "name": "pantone-number",
                    "url": "http://www.pantone.com"
                }
            }
        ],
        "naming-source": "Pantone",
        "nickname": "",
        "color-family": "Yellow Shades",
        "color-codes": {
            "hex": {
                "values": {
                    "r1": "5",
                    "r2": "8",
                    "g1": "5",
                    "g2": "4",
                    "b1": "4",
                    "b2": "2",
                    "a1": "0",
                    "a2": "0"
                }
            },
            "rgb": {
                "values": {
                    "r": 88,
                    "g": 84,
                    "b": 66
                }
            },
            "hsl": {
                "values": {
                    "h": 49,
                    "s": 14,
                    "l": 30
                }
            },
            "cmyk": {
                "values": {
                    "c": 0,
                    "m": 5,
                    "y": 25,
                    "k": 65
                }
            }
        },
        "description": "A dark, muted yellow with warm orange-yellow tones."
    }
]
