[
    {
        "unique-color-id": "7480876",
        "name": "Merlot",
        "other-names": [
            {
                "name": "Merlot",
                "source": {
                    "name": "Pantone",
                    "url": "http://www.pantone.com"
                }
            },
            {
                "name": "19-1534",
                "source": {
                    "name": "pantone-number",
                    "url": "http://www.pantone.com"
                }
            },
            {
                "name": "Tamarillo",
                "source": {
                    "name": "color.pizza",
                    "url": "https://github.com/meodai/color-names"
                }
            }
        ],
        "naming-source": "Pantone",
        "nickname": "",
        "color-family": "Brown Shades",
        "color-codes": {
            "hex": {
                "values": {
                    "r1": "7",
                    "r2": "2",
                    "g1": "2",
                    "g2": "6",
                    "b1": "2",
                    "b2": "C",
                    "a1": "0",
                    "a2": "0"
                }
            },
            "rgb": {
                "values": {
                    "r": 114,
                    "g": 38,
                    "b": 44
                }
            },
            "hsl": {
                "values": {
                    "h": 355,
                    "s": 50,
                    "l": 30
                }
            },
            "cmyk": {
                "values": {
                    "c": 0,
                    "m": 67,
                    "y": 61,
                    "k": 55
                }
            }
        },
        "description": "A dark, moderately saturated brown with earthy warm red-pink tones."
    }
]
